content,topic
"Если бы в начале нулевых годов Россия приняла новый «Свод правил русского правописания», то сейчас она имела бы более современные и актуальные правила орфографии. Об этом в интервью «Ленте.ру» рассказал кандидат филологических наук, научный сотрудник Института русского языка им. В.В. Виноградова РАН, научный руководитель портала «Грамота.ру», председатель Филологического совета Тотального диктанта Владимир Пахомов.
«Даже опыт Тотального диктанта показывает, что правильно разграничить и написать многие прилагательные и причастия действительно бывает очень трудно — для этого подчас требуется тончайший лингвистический анализ, — отметил Пахомов. — Это объективно очень сложные правила русской орфографии, на что давно указывали многие лингвисты». Ученый подчеркнул, что изменения в написании некоторых слов, предложенные в 2000 году Орфографической комиссией РАН, были не реформой, а мерами по систематизации русского правописания.
Опозиция против корупции
Лингвист отметил, что не относится к тем, кто полагает необходимым иметь беспрецедентно высокую планку, чтобы грамотное письмо могли освоить немногие. При этом он сослался на опыт несостоявшейся орфографической реформы 1964 года, которая базировалась на серьезных научных основаниях, а ее подготовке предшествовала огромная научная работа под руководством лучших языковедов того времени. Как пояснил ученый, многие положения нереализованной реформы 1964 года об упрощении русского правописания с научной точки зрения были логичными и обоснованными, хотя сейчас некоторые из них могут показаться экзотическими.
Можно без преувеличения сказать, что именно во время дискуссий по поводу этой реформы русская орфография окончательно оформилась как наука
Владимир Пахомов
кандидат филологических наук
Пахомов напомнил, что орфографическая реформа 1964 года, которой в этом году исполнится 60 лет, предполагала изменения многих правил русской орфографии. В начале 1960-х годов в СССР сложилась ситуация, когда в подобной реформе были заинтересованы и властные круги, и учителя, и лингвисты. Руководство страны считало, что существующие правила русской орфографии и пунктуации слишком сложны, на их изучение тратится неоправданно много школьных часов, которые можно было бы более эффективно употребить на овладение новыми трудовым навыками и рабочими специальностями.
Фото: Oleg Elkov / Shutterstock / Fotodom
Идею значительного упрощения правил правописания горячо поддержали школьные учителя. «Они лучше других понимали, насколько сложна для изучения русская орфография», — пояснил лингвист. В ней очень много правил правописания, исключений из них еще больше, школьных часов на изучение русского языка предусмотрено совсем мало, а в результате многие дети писали неграмотно. Это касалось и школьников, для которых русский язык был родным, но даже они «допускали колоссальное количество ошибок в не самых сложных словах вроде песчаный или искусство».
По словам Пахомова, в реформе правописания были заинтересованы и советские лингвисты. После утверждения Правил 1956 года им стало ясно, что в русской орфографии все равно осталось очень много неточностей и нестыковок. «Важно понимать, что перед лингвистами никогда не стоит задача упрощения ради упрощения, — подчеркнул ученый. — Их задача — сделать правила правописания более стройными, логичными и системными».
В ходе орфографической реформы 1964 года намечалось упразднить твердый знак (Ъ), отменить написание мягкого знака (Ь) в конце слова после шипящих (доч, ноч, мыш, стрич, настеж), после ц всегда писать и (огурци, отци, бледнолиций, циган). Также планировалось перестать удваивать согласные в заимствованных из иностранных языков словах (вместо теннис — тенис, вместо коррупция — корупция, вместо оппозиция — опозиция, вместо коррозия — корозия) и упразднить большинство исключений из правил русского языка (вместо жюри — жури, вместо брошюра — брошура, вместо парашют — парашут, вместо заяц — заец, вместо деревянный, стеклянный, оловянный — деревяный, стекляный, оловяный).
Однако после отставки Никиты Хрущева в октябре 1964 года орфографическая реформа была отменена. Как пояснил Пахомов, одной из основных причин этого стало недовольство консервативной части общества, которая активно ее критиковала, причем непрофессионально и необоснованно. «В колоссальном числе негативных откликов на проект реформы правописание нередко смешивалось с произношением — оппоненты реформы совершенно необоснованно указывали, что изменения в орфографии якобы неизбежно повлекут за собой перемены в орфоэпии», — объяснил Пахомов.
Никита Хрущев
Фото: В. Лебедев / РИА Новости
По его мнению, в результате те проблемы русской орфографии, которые должна была решить реформа 1964 года, до сих пор остаются с нами. Если бы ее тогда удалось воплотить в жизнь, возможно, одно-два поколения носителей русского языка пережили бы некоторый культурный шок, но сейчас мы бы совершенно спокойно писали ноч и огурци.
Увы, в середине 1960-х годов был надолго упущен шанс сделать русскую орфографию системнее, стройнее, логичнее и проще
Владимир Пахомов
кандидат филологических наук
Парашут с брошурой
Отмена реформы 1964 года, разработке которой сопутствовало проведение огромной научной работы, больно ударила по лингвистам. Однако после этого советским филологам уже ничего не оставалось, кроме как изучать современную орфографию и фиксировать отдельные ее изменения. Но в 1970-1980-е годы орфографическая работа в СССР продолжалась. Регулярно выходили экспериментальные словари, нормативный словарь русского языка периодически пересматривал написание некоторых слов. «В те годы мои старшие коллеги-лингвисты активно работали, но уже не могли планировать никаких радикальных изменений, поскольку очень сильна была тяжелая память об отвергнутом проекте 1964 года», — пояснил Пахомов.
Деятельность Орфографической комиссии Академии наук СССР возобновилась в 1988-1989 годах, во время горбачевской перестройки. Она была создана для подготовки новой редакции правил русского правописания, которые представила на суд общественности в 2000 году. В проекте «Свода правил русского правописания» лингвисты предлагали систематизировать нормы орфографии и упразднить самые сложные и нелогичные из них.
Из проекта 1964 года в него перекочевали единичные предложения, например: в правиле о написании гласных и, а после шипящих убрать исключения для слов брошюра, жюри, парашют (то есть теперь писать их как брошура, жури, парашут. Но, по словам ученого, обсуждение нового «Свода правил» в средствах массовой информации вылилось в совершенно безобразный скандал под лозунгом «руки прочь от русского языка».
Появилось множество безграмотных публикаций, (…) блогеры, публицисты и журналисты писали всякие нелепицы о якобы готовящейся «лопатинской реформе» русского языка, которая «на пустом месте создает серьезные духовно-общественные проблемы»
Владимир Пахомов
кандидат филологических наук
В результате, как заметил Пахомов, в России до сих пор действуют Правила 1956 года, которые за последние 23 года еще более отдалились от современной письменной практики. За это время накопилось еще больше несоответствий между ними, рекомендациями современных словарей, справочников и реальной картиной письма. «В этом смысле все осталось, как было в 2000 году, только стало немного хуже», — резюмировал ученый.
По мнению лингвиста, никакой новой орфографической реформы в России в ближайшие десятилетия не предвидится. «Для этого нет ни соответствующих условий, ни чьего-либо запроса», — подчеркнул Пахомов. Теперь главная задача — официально утвердить полноценный «Свод правил русской орфографии и пунктуации», нацеленный не на кардинальные изменения в русском письме, а на подробное описание уже существующих языковых реалий.",8
"Ученые смогли объяснить причины загадочной смерти британских археологов, которые 100 лет назад открыли гробницу египетского фараона Тутанхамона, пишет РИА Новости. Десятилетиями ходили слухи о таинственном «проклятии», которое было наложено на исследователей.
Гробницу Тутанхамона после многолетних поисков открыл британский археолог Говард Картер. Через несколько лет после открытия люди, связанные с находкой, скончались. Среди них был и сам Картер.
Теперь ученые полагают, что исследователи скончались вследствие «пещерной болезни», вызванной грибками Aspergillus, обнаруженными в гробнице. В подобных условиях грибы живут очень долго, а кроме того, они повышают свою вирулентность
. В частности, из-за Aspergillus мог умереть спутник Картера — лорд Карнарвон.
Похожая судьба ждала участников вскрытия другого объекта — могилы литовского князя Казимира Ягеллончика, — они скончались от легочной инфекции.
Таким образом, слухи о проклятии Тутанхамона можно считать лишь мифом.
Ранее сообщалось о новом открытии египетских археологов. Они полагают, что гробница египетской царицы Нефертити находится прямо за стенами гробницы Тутанхамона.",8
"Итальянские астрономы идентифицировали доисторическую карту звездного неба, которая была обнаружена в городище Рупинпикколо на северо-востоке Италии. Об это сообщается в статье, опубликованной в журнале Astronomical Notes.
Ученые проанализировали узоры на каменном диске, датированном между 1800 и 1650 годами до нашей эры. В отличие от другого подобного диска, найденного в Хорватии, отметины, оставленные долотом, не выглядели хаотично расположенными, и исследователи предположили, что они соответствуют реальному изображению звездного неба.
Обнаружено, что девять отметок соответствуют Хвосту Скорпиона, а пять — Поясу Ориона, Ригелю и Бетельгейзе. Девять отметок находятся приблизительно на месте Плеяд, что указывает на некоторое совпадение с членами звездного скопления. На противоположной стороне расположены пять отметин, которые, возможно, воспроизводят Кассиопею.
Однако ученые не смогли идентифицировать одну отметку немного севернее Ориона. Поскольку соответствие звездному небу статистически достоверно, исследователи высказали предположение, что неопознанный знак может указывать на неудавшуюся сверхновую, когда звезда коллапсирует в черную дыру без яркой вспышки.",8
"Человечество может столкнуться с угрозой новой пандемии из-за вирусов, которые нашли в вечной мерзлоте Сибири. Об этом пишет The Guardian.
По мнению ученых, есть риск, что древние сибирские вирусы могут высвободиться из-за глобального потепления и вызвать вспышку неизвестных заболеваний. Штаммы этих «микробов Мафусаила» — или вирусов-зомби, как их еще называют, — уже были выделены исследователями. Ученые предупредили, что следующая пандемия может быть вызвана не новыми вирусами, а болезнью из далекого прошлого. В связи с этим биологи начали планировать создание арктической сети мониторинга, которая будет выявлять случаи заболеваний, вызванных древними микроорганизмами. Служба будет обеспечивать карантин и квалифицированную медицинскую помощь инфицированным, а также контролировать передвижение людей в зоне заражения.
«Сейчас анализ пандемических угроз сфокусирован на заболеваниях, которые могут возникнуть в южных регионах, а затем распространиться на север. При этом мало внимания уделяется возможной вспышке на Крайнем Севере, которая может распространиться на юг, — и я считаю, что это упущение. Там есть опасные вирусы, которые могут заразить людей и вызвать новую эпидемию», — сообщил генетик Жан-Мишель Клавери из университета Марселя.
Материалы по теме:
«На восемь градусов потеплело — сумасшедшая цифра»Что происходит с климатом и почему минувшей зимой в Москве не было снега и морозов
7 марта 2020
«Мы не знаем до конца, что под мерзлотой»За полярным кругом Земли просыпаются гигантские вирусы. Стоит ли их бояться?
15 августа 2020
В 2014 году Клавери возглавил группу ученых, которые изолировали живые вирусы в Сибири и доказали, что они по-прежнему способны инфицировать одноклеточные организмы, несмотря на тысячелетия, проведенные в вечной мерзлоте. Исследования, опубликованные в 2023 году, выявили существование нескольких вирусных штаммов в семи разных точках Сибири, которые могут инфицировать культивируемые клетки. Возраст одного из микроорганизмов составлял 48,5 тысячи лет.
«Вирусы, которые мы выделили, были способны заражать только амебы и не представляли риска для человека. Однако мы идентифицировали геномные следы поксвирусов и герпесвирусов, которые, являются хорошо известными патогенами человека», — сказал Клавери.
При этом самый высокий риск представляет не таяние вечной мерзлоты. «Опасность исходит от другого фактора глобального потепления: от исчезновения арктического морского льда. Это изменение позволит увеличить судоходство, транспортное сообщение и промышленное развитие Сибири. Планируются масштабные горнодобывающие операции, в ходе которых в глубокой вечной мерзлоте будут пробурены огромные скважины и шахты для добычи нефти и руды. Эти действия высвободят огромное количество патогенов, которые все еще лежат там. Шахтеры будут спускаться туда и дышать вирусами. Последствия могут быть катастрофическими», — объяснил Клавери.",8
"Ученые показали, что поливитаминные добавки улучшают память и замедляют когнитивное старение у пожилых людей. Об этом сообщается в статье, опубликованной в журнале American Journal of Clinical Nutrition.
Специалисты проанализировали данные 573 участников крупномасштабного исследования эффективности поливитаминов и пищевых добавок из экстракта какао (COSMOS). Была проведена детальная оценка когнитивных функций добровольцев, в результате которой было отмечено умеренное влияние поливитаминов по сравнению с плацебо на умственные способности в течение двух лет.
Так, ученые выявили статистически значимое преимущество приема поливитаминов в отношении изменений эпизодической памяти, но не исполнительных функций мозга, в том числе внимания и планирования действия в соответствии с общей целью. В целом ежедневный прием поливитаминов, содержащих более 20 незаменимых микроэлементов, замедлил когнитивное старение примерно на два года по сравнению с плацебо.
Ранее сообщалось, что исследователи Института Фрэнсиса Крика раскрыли пользу обычных пищевых добавок, содержащих индолы. Соответствующая диета может защитить от хронической инфекции, вызванной криптоспоридиями, которые распространены среди детей до двух лет.",8
