content,topic
"Специалисты организации Anthropic, создавшей чат-бот Claude, рассказали о новой опасности искусственного интеллекта (ИИ). Исследование опубликовано на сервере препринтов arXiv.
Ученые заявили, что злоумышленники могут запрограммировать чат-бота таким образом, чтобы машина генерировала вредоносный код. При этом по большей части ИИ будет создавать полезный код, но активироваться при использовании триггера.
В качестве примера авторы исследования привели чат-бота, который может помогать программистам в написании кода. Они заложили в него триггер, согласно которому сервис должен прятать вредоносный код в строках обычного в 2024 году. С наступлением нового года ученые обнаружили, что «спящий агент» активировался и начал незаметно создавать в коде уязвимости.
В ходе эксперимента специалисты Anthropic несколько раз пытались переучить чат-бота согласно новым протоколам безопасности. Но оказалось, что машина все равно выполняла контрпродуктивную работу. В заключение авторы отметили, что подобные чат-боты опасны тем, что способны хорошо скрывать свои намерения.
В декабре международная группа ученых доказала, что искусственный интеллект (ИИ) можно использовать в преступных целях. Специалисты выяснили, что с помощью чат-ботов можно создать собственную генеративную модель ИИ, научив ее обходить встроенные ограничения.",8
"Командующий Тихоокеанским флотом (ТОФ) Военно-морского флота (ВМФ) России Виктор Лиина сообщил о ведении работ по переоснащению подлодок проекта 949А «Антей» новым ракетным комплексом для решения задач, схожих с целями лодок серии «Ясень». Об этом он сообщил в интервью телеканалу «Звезда».
Лиина подчеркнул, что лодки этого проекта имеют очень хороший модернизационный потенциал.
«Проходит модернизация одной из подводных лодок 949-го проекта, которая будет оснащена новым ракетным комплексом, новыми средствами аэротехнического вооружения, связи, будут поставлены новые обслуживающие комплексы. Она другого водоизмещения, но будет решать такие же задачи, приблизительно как и ""Ясень""», — заявил командующий ТОФ ВМФ России.
В ноябре стало известно, что две российские подлодки проекта Варшавянка могут совершить переход с Балтийского моря на Тихоокеанский флот «южным» маршрутом через Средиземное море, а не через Северный морской путь.
Еще раньше сообщалось, что экипаж дизель-электрической подводной лодки «Можайск», которая проходила заводские ходовые испытания в морских полигонах Балтийского флота, отработал первые погружения корабля на глубину.",8
"Корпорация Lockheed Martin совместно с национальным управлением по аэронавтике и исследованию космического пространства США (НАСА) представили экспериментальный сверхзвуковой самолет X-59, который сможет преодолеть звуковой барьер со сниженным уровнем шума. Об этом сообщается на сайте управления.
Презентация самолета прошла на заводе в калифорнийском Палмдейле. X-59 разрабатывался в рамках программы Quesst. В НАСА уточнили, что проект посодействует снятию запрета на коммерческие сверхзвуковые полеты. Ограничение на такие полеты действуют более 50 лет.
Отмечается, что разработка X-59 началась в 2019 году, сборка завершилась в 2021-м. Первый тестовый полет запланирован на конец весны или лето 2024 года. В НАСА сообщили, что самолет сможет достигать скорости в 1488 км/ч на высоте до 16,8 тысячи метров.
Ранее американское издание The National Interest назвало Су-35 «способным противником» американского F-35.",8
"Корпорация Apple выпустила обновление для компьютеров Mac, закрывающее уязвимость, позволявшую шпионить за пользователями устройств. Об этом сообщает издание 9to5Mac.
Уязвимость с идентификатором CVE-2024-0230 была обнаружена в конце 2023 года. По словам специалистов, она позволяла злоумышленнику получать ключ Bluetooth, с помощью которого клавиатура соединялась с компьютером, и перехватывать данные. Таким образом, например, хакер мог отследить всю информацию, которую пользователь вводил в свой девайс.
В компании рассказали, что уязвимости были подвержены все беспроводные клавиатуры, когда-либо выпускаемые Apple — в том числе первые модели Magic Keyboard и актуальные версии с дактилоскопическим сенсором Touch ID. Представители корпорации не уточнили, скольких пользователей могли взломать через системную брешь. Однако в материале говорится, что совершить атаку можно было только при непосредственном, а не удаленном, контакте с устройством. По словам инженеров Apple, устраняющая проблему прошивка 2.0.6 может быть установлена в фоновом режиме, пока клавиатура подключена к macOS, iOS, iPadOS или tvOS.
В середине января специалисты полиции Пекина рассказали о способе идентификации пользователей, передающих данные с одного iPhone на другой через AirDrop. В Apple не прокомментировали сообщение.",8
"Американская космическая корпорация SpaceX отчиталась об отправке первого текстового сообщения через спутники Starlink. Об этом сообщается в документе, опубликованном на сайте проекта.
В компании отметили, что отправили первую серию сообщений посредством новых спутников Direct to Cell, которые могут соединяться непосредственно с телефонами. Партнером фирмы Илона Маска выступил мобильный оператор T-Mobile.
В SpaceX рассказали, что при отправке СМС им пришлось решить несколько проблем. Так, спутники, в отличие от наземных базовых станций, передвигаются с большой скоростью. Для плавного переключения между спутниками инженерам пришлось учитывать эффект Доплера и временные задержки. «Телефоны также невероятно сложно подключить к спутникам, находящимся на расстоянии сотен километров, учитывая низкий коэффициент усиления антенны и мощность передачи смартфона», — отметили в компании.
Согласно профилю SpaceX в соцсети X, первым отправленным через спутники Starlink текстовым сообщением оказалось «Привет». В компании показали экраны двух смартфонов, через которые специалисты корпорации общались посредством СМС.
В октябре 2023 года SpaceX обозначила сроки запуска новой услуги по подключению спутников Starlink к телефонам. Согласно планам корпорации, в 2024 году будет налажена передача данных через СМС, в 2025 году станет доступна голосовая связь.",8
"Гарнитуру дополненной реальности от Apple нельзя будет полноценно использовать в России. Об этом сообщает издание MacRumors.
Согласно материалам Apple, Vision Pro — по крайней мере на старте продаж в феврале — будет подготовлена только для пользователей из США. Так, девайс будет работать только с аккаунтом Apple ID, зарегистрированным в Соединенных Штатах, также очки будут поддерживать только английский язык — локализация для других регионов не предусмотрена.
Кроме того, многие приложения окажутся бесполезными из-за региональных ограничений, если использовать их в других странах. Техническую поддержку пользователям Vision Pro специалисты Apple смогут оказать также только в США.
В заключение журналисты медиа напомнили, что потребители, испытывающие проблемы со зрением, смогут заказать специальные линзы, совместимые с Vision Pro. Однако Apple продаст их только при наличии медицинского рецепта, выписанного офтальмологами из США.
Ранее инсайдер Мин-Чи Ко заявил, что корпорация Apple запланировала глобальные продажи очков дополненной реальности Vision Pro до лета 2024 года. По состоянию на конец января, девайс доступен для заказа только в США.",8
"Европейская комиссия (ЕК) рассказала о предложении Apple добавить на iPhone сторонние платежные системы. Об этом сообщает издание The Verge.
Документ был опубликован на сайте европейского регулятора. В нем говорится, что компания Apple предложила принять на себя обязательства «по решению проблем конкуренции», связанных с доступом к NFC на iPhone. Таким образом, в корпорации одобрили появление замены Apple Pay на смартфонах бренда — в начале декабря об этом рассказывали источники Reuters.
В материале говорится, что пользоваться сторонними платежными системами, которая будет основана на технологии NFC на iPhone, смогут владельцы смартфонов с Apple ID, зарегистрированным в стране Европейской экономической зоны. Обязательства будут действовать 10 лет. Apple также согласилась на штраф в размере до 10 процентов от мирового годового оборота, если нарушит обязательства.
Пока неизвестно, как на сообщение ЕК отреагируют операторы платежных систем и конкуренты Apple. Также не уточняется, когда альтернативные Apple Pay системы могут появиться на iPhone.
Ранее корпорация Apple смягчила требования к приложениям для iPhone и iPad. Компания разрешила размещать в приложениях платежные ссылки на сторонние ресурсы, но продолжила взимать комиссию с разработчиков.",8
"В следующем поколении iPhone Apple добавит версию с двумя терабайтами встроенной памяти. Об этом сообщает издание 9to5Mac.
Журналисты медиа сослались на отчет корейского инсайдера под ником yeux1122. По словам специалиста, iPhone 16 Pro будет иметь версию с двумя терабайтами встроенной памяти. Смартфон будет использовать флеш-память стандарта Qual Level Cell (QLC).
По словам авторов издания, актуальные телефоны Apple имеют максимум один терабайт встроенной памяти. Также они отметили, что QLC в сравнении с форматом TLC имеет более низкую скорость чтения и записи. Таким образом, американская компания может умышленно ухудшить iPhone.
Причина, по которой Apple выберет накопители QLC, заключается в дешевизне компонентов. Таким образом, корпорация может заметно сэкономить на производстве флагманов. Судя по всему, версию с двумя терабайтами встроенной памяти получат только смартфоны iPhone 16 Pro и 16 Pro Max. Выход устройств должен состояться в сентябре.
В середине января аналитик Джефф Пу заявил, что компания Apple увеличит минимальный объем оперативной памяти в своих смартфонах. Все аппараты линейки iPhone 16 должны получить восемь гигабайт оперативной памяти.",8
"Преподаватель кафедры КБ-1 «Защита информации» РТУ МИРЭА Василий Шутов в беседе с агентством «Прайм» рассказал, что использование «неродной» зарядки не принесет смартфону никакого вреда.
Проблема выбора блока питания возникла после того, как производители смартфонов перестали класть зарядное устройство в заводскую коробку. Владельцы гаджетов начали использовать более дешевые налоги.
По словам Шутова, «неродная» зарядка не принесет устройству никакого вреда. «Телефон не ""перезарядится"" при выборе более мощной зарядки. Смартфон просто не сможет взять больше, чем предусмотрел производитель», — уточнил он.
Исключение — использование недорогих блоков питания и тех, у которых отсутствуют сертификаты соответствия, подчеркнул специалист.
Ранее IT-эксперт Алексей Учакин назвал правила безопасной зарядки смартфонов. Эксперт отметил, что многие не знают о том, что зарядка гаджета в автомобиле может негативно сказаться на аккумуляторе.",8
"Китайская корпорация Xiaomi запланировала выпуск первого смартфона-раскладушки. Об этом сообщает издание MySmartPrice.
Девайс, о разработке которого инсайдеры рассказывали летом, будет иметь форм-фактор раскладушки и визуально напоминать Samsung Galaxy Z Flip4. Аппарат под названием Mix Flip получил сертификацию Министерства промышленности и информационных технологий Китая (MIIT), в документах говорится о поддержке спутниковой связи.
По словам журналистов, подобная опция позволит телефону подключаться к спутникам на низкой околоземной орбите в случае, если сотовая связь отсутствует. Также раскладушка должна получить процессор Snapdragon 8 Gen 2, тройную камеру с трехкратным оптическим зумом и актуальную версию Android.
Авторы издания отметили, что поддержка спутниковой связи пока не стала популярной опцией среди смартфонов на рынке — она присутствует только в iPhone и устройствах серии Huawei Mate 50. При этом в 2022 году Qualcomm заключила соглашение с Xiaomi, Motorola, Nothing, Oppo, Vivo и Honor, чтобы обеспечить их аппараты спутниковой связью.
Ранее аналитики IDC рассказали, что компания Apple возглавила рынок смартфонов. В топ-3 также попали прежний лидер Samsung и Xiaomi.",8
"Компания Apple назвала точные характеристики гарнитуры Vision Pro. Об этом сообщается на странице девайса на сайте корпорации.
В Apple раскрыли точную информацию об устройстве в связи со стартом предзаказов на модель в США. В компании подтвердили, что очки дополненной реальности получили процессор M2 с 8 ядрами и графический ускоритель с 10 ядрами. Vision Pro имеет 16 гигабайт оперативной памяти. Кроме того, гаджет оснащен новым процессором R1, который обрабатывает входящие данные от 12 камер, пяти датчиков и шести микрофонов.
Аппарат получил двойные дисплеи micro-OLED, которые отображают более 23 миллионов пикселей и охватывают 92 процента цветового пространства DCI-P3. Экраны поддерживают частоту обновления до 100 герц и позволяют воспроизводить видео с частотой 30 кадров в секунду. Девайс доступен с вариантами 256 и 512 гигабайт, а также 1 терабайт.
Кроме того, Vision Pro поддерживает Wi-Fi 6, Bluetooth 5.3, HDR10, технологию пространственного звучания с динамическим отслеживанием положения головы. Автономность устройства составляет максимум 2,5 часа. Стартовая модель обойдется в 3499 долларов, версия с 1 терабайтом памяти стоит 3899 долларов.
Ранее аналитик Мин-Чи Ко заявил, что Apple запланировала глобальные продажи очков дополненной реальности Vision Pro до лета 2024 года. Вероятно, девайс можно будет купить в Европе и других регионах мира уже весной.",8
"Появление искусственного интеллекта (ИИ) на персональных компьютерах потребует модернизации оборудования. Об этом сообщается в отчете TrendForce.
По мнению аналитиков, 2024 год ознаменует собой выход компьютеров, способных работать с ИИ на продвинутом уровне. В том числе, инструменты для работы с искусственным интеллектом появятся в потребительских ПК, из-за чего неизбежно вырастут системные требования операционных систем, включая Windows.
В материале говорится, что для корректной работы компьютеру нужно будет минимум 16 гигабайт оперативной памяти. Это вызовет необходимость пользователей приобрести новый ПК или провести апгрейд старого.
По информации TrendForce, необходимые для работы с ИИ компьютеры должны будут иметь мощность не менее 40 терафлопс. Этому показателю будут соответствовать новые чипы — Intel Lunar Lake, AMD Ryzen 8000, Qualcomm Snapdragon X Elite.
В начале января специалисты Canalys заявили, что в 2024 году каждый пятый появившийся на рынке ПК — или более 170 миллионов единиц устройств — будет иметь встроенную поддержку ИИ. Почти 60 процентов ПК с поддержкой искусственного интеллекта будет выпущено для организаций и бизнеса.",8
