content,topic
"Ученые Калифорнийского университета в Беркли предложили построить флот небольших космических кораблей, которые для передвижения используют энергию солнечного света, улавливаемую парусом. Об этом сообщается в статье, опубликованной в журнале Acta Astronautica.
Проект Беркли по созданию дешевого межпланетного солнечного паруса (BLISS) основывается на других проектах малых космических аппаратов, включая CubeSat, ChipSats и Breakthrough Starshot Initiative. Его целью является быстрое и недорогое исследование внутренних областей Солнечной системы.
В новой работе ученые описали аппаратное обеспечение, необходимое для создания миниатюрного космического корабля массой около десяти граммов с использованием солнечного паруса площадью один квадратный метр, чья конфигурация управляется микроэлектромеханическими системами (МЭМС) с червячными передачами. Малый размер паруса, который прикрепляется к корпусу с помощью нитей из углеродного волокна, позволяет кораблю быть более маневренным.
Примером возможных миссий может быть сбор образцов кометной пыли на относительно низких скоростях для уменьшения риска разрушения органических веществ.",8
"Межпланетная станция Mars Express обнаружила свидетельства наличия крупных залежей воды в формации Medusae Fossae на Марсе. Об открытии сообщается в статье, опубликованной в журнале Geophysical Research Letters, кратко о нем рассказывается в пресс-релизе на Phys.org.
Исследователи проанализировали результаты наблюдений, проведенные с помощью радара станции, и обнаружили, что выявленные 15 лет назад отложения глубиной несколько километров, на самом деле гораздо толще, чем считалось ранее, и залегают на глубинах вплоть до 3,7 километра. Данные соответствуют сигналам, отраженным от слоистого льда, и похожи на сигналы от полярных шапок Марса.
В случае таяния всего льда в Medusae Fossae, планета покроется слоем воды от 1,5 до 2,7 метра, что соответствует объему Красного моря. Размер и расположение ледяных отложений делает их потенциально очень ценными для будущих исследований Марса, в том числе в качестве ресурса для возможных колоний. Однако пока что этот резервуар недоступен, поскольку покрыт слоем реголита толщиной несколько сотен метров.
Ранее ученые Планетологического института определили максимальные сроки появления сетей марсианских долин, образованных проточной водой. Размыв происходил очень медленно и мог охватывать сотни миллионов лет.",8
"По энергетическим системам перспективная Российская орбитальная станция (РОС) будет отличаться от российского сегмента Международной космической станции (МКС). Об этом «Известиям» стало известно от заместителя генерального конструктора Ракетно-космической корпорации (РКК) «Энергия» и главного конструктора РОС Владимира Кожевникова.
По его словам, перспективная РОС будет обладать высокой энергетикой, в частности солнечными батареями большой площади мощностью 54 киловатта. «Для сравнения, на российском сегменте МКС сейчас используют всего 6 киловатт (это как три включенных электрочайника). Напряжение сети на РОС планируется 120 вольт, тогда как сейчас на российском сегменте МКС космонавты используют 28 вольт», — сказал специалист.
Конструктор добавил, что перспективная РОС «будет обладать значительно более широкими возможностями по сравнению с любыми малыми космическими объектами».
Материалы по теме:
Истинный РОСС.Россия создает свою космическую станцию. Что о ней известно?
1 июня 2021
Дальше сами.Россия решила выйти из проекта МКС. Какое будущее ждет российскую космонавтику?
27 июля 2022
Также в интервью изданию Кожевников заявил, что перспективную РОС оборудуют суперкомпьютером, обладающим высокими вычислительными мощностями, который будет считывать данные с группировок спутников.
В декабре в РКК «Энергия» заявили, что коммерческий модуль перспективной РОС может получить панорамные иллюминаторы, подобные обзорному модулю Cupola американского сегмента МКС.",8
"Российскую орбитальную станцию (РОС) оборудуют суперкомпьютером, обладающим высокими вычислительными мощностями, который будет считывать данные с группировок спутников. Об этом рассказал заместитель генерального конструктора Ракетно-космической корпорации «Энергия» (входит в Роскосмос), главный конструктор РОС Владимир Кожевников в беседе с «Известиями».
«В его задачи, в том числе будет входить получение сырых данных со спутников, обработка этих данных на борту и передача на Землю», — уточнил Кожевников. Это повысит эффективность орбитальных группировок за счет экономии энергии на связь и увеличению объема полезной информации.
По словам главного конструктора РОС, избыточными вычислительными ресурсами суперкомпьютера смогут пользоваться бортовые ЭВМ спутников. Все эти цели можно будет достичь благодаря развитию технологий лазерной связи и квантовой передачи данных.
Эскизный проект станции находится на этапе утверждения в Роскосмосе, планируется, что его примут в феврале 2024 года.
Ранее президент России Владимир Путин поручил кабмину разработать комплекс мер, которые позволят нарастить вычислительные мощности суперкомпьютеров, и предоставить ему доклад к 1 марта. Ответственным за выполнение поручения назначен премьер-министр РФ Михаил Мишустин.",8
"В ночь на 21 января в небе над Берлином сгорел астероид Sar2736. Об этом сообщает Tagesschau.
По информации НАСА, фрагменты астероида упали в 00:32 на территории федеральной земли Бранденбург, Германия. Взрыв и падение небесного тела попали на видео. Камеры наблюдения в Лейпциге и Праге также зафиксировали светящийся огненный шар в небе.
Астрофизик из Европейского космического агентства Рихард Мойсль сообщил в разговоре с журналом Der Spiegel, что метеорит вошел в атмосферу Земли на относительно небольшой скорости — всего несколько километров в секунду. Поисковые группы отправились за фрагментами небесного тела.
Ранее ученые Университета Колорадо в Боулдере и Лаборатории реактивного движения НАСА предложили использовать прыгающие зонды для измерения гравитации на астероидах. Проект Gravity Poppers предусматривает создание группы зондов, которую выпускают на поверхность астероида, кометы или небольшой луны.",8
"Международная группа астрономов обнаружила в Млечном Пути загадочный объект, который тяжелее самых тяжелых из известных нейтронных звезд, и в том же время легче всех известных черных дыр. Об этом сообщается в статье, опубликованной в журнале Science.
В ходе наблюдений, проведенных с помощью радиотелескопа MeerKAT, был обнаружен объект на орбите быстро вращающегося миллисекундного пульсара, расположенного на расстоянии около 40 тысяч световых лет от Земли в шаровом скоплении NGC 1851.
Моделирование позволило реконструировать наиболее вероятный сценарий возникновения необычной системы. Первоначально на ее месте существовала двойная система пульсар-белый карлик, однако затем белый карлик был выбит с орбиты из-за прибытия третьего тела неизвестной природы, которое заняло его место. Это тело может быть либо чрезвычайно легкой черной дырой, либо сверхмассивной нейтронной звездой.
По словам астрономов, дальнейшее изучение объекта и выяснение его видовой принадлежности может стать поворотным моментом в понимании эволюции нейтронных звезд или черных дыр.",8
"Марсианский вертолет Ingenuity потерял связь с марсоходом Perseverance, который выполняет функции ретранслятора между вертолетом и Землей. Об этом сообщили в Национальном управлении США по аэронавтике и исследованию космического пространства (НАСА).
Данные, которые Ingenuity отправил на марсоход в ходе полета, указывают на то, что вертолет успешно поднялся на высоту в 12 метров.
«Во время запланированного снижения связь между вертолетом и марсоходом прервалась досрочно, до приземления. Команда Ingenuity анализирует имеющиеся данные и рассматривает дальнейшие шаги по восстановлению связи с вертолетом», — говорится в сообщении.
Материалы по теме:
Русская планета:как советские ученые смогли покорить Венеру
16 ноября 2022
Лунная гонка, взрывы ракет Илона Маска и спутники Северной Кореи.Как 2023 год изменил мировую космонавтику?
27 декабря 2023
Ingenuity, который доставили на Марс на борту ровера Perseverance, совершил первый полет в 19 апреля 2021 года. 1,8-килограммовый аппарат оснащен солнечной панелью для зарядки аккумуляторов. Батарей хватает на один полет длительностью в 90 секунд в течение марсианского дня.
В апреле 2023 года издание SpaceNews писало, что Китай может включить вертолет в миссию по сбору и доставке на Землю образцов марсианского грунта «Тяньвэнь-3». В рамках миссии планируют собрать и доставить на Землю 500 граммов марсианского грунта.",8
"Корпус стражей исламской революции (КСИР, элитные части Вооруженных сил Ирана) вывел на орбиту спутник Soraya. Об этом сообщает агентство Tasnim.
Отмечается, что трехступенчатая ракета-носитель Qaem 100 успешно вывела 50-килограммовый аппарат на орбиту высотой 750 километров.
Разработанная Воздушно-космическими силами КСИР твердотопливная ракета Qaem 100 способна выводить полезную нагрузку массой до 80 килограммов на орбиту высотой 750 километров.
Материалы по теме:
«Эту ракету мы создавали по его указанию»Как при Сталине СССР хотел запустить человека в космос
4 октября 2023
Лунная гонка, взрывы ракет Илона Маска и спутники Северной Кореи.Как 2023 год изменил мировую космонавтику?
27 декабря 2023
В октябре стало известно, что Иран и Россия ведут переговоры о создании нового космического аппарата «Хайям-2». Также Москва и Тегеран не исключают создание спутника дистанционного зондирования Земли, малого геоспутника и телекоммуникационного аппарата.
В том же месяце глава Космического агентства Ирана Хасан Салари сообщил, что Иран начал разработку ракеты, которая предназначена для запуска спутников на геостационарную орбиту. Носитель получил название «Сарир».",8
"Дальние ракетоносцы-бомбардировщики Ту-22М (по кодификации НАТО: Backfire) Воздушно-космических сил России могут представлять угрозу для США и их союзников. Об этом пишет американское издание The National Interest (NI).
«Учитывая постоянно ухудшающееся состояние российско-американских отношений, к угрозе, которую бомбардировщики Ту-22М Backfire могут представлять для активов Америки и ее союзников, по-прежнему следует относиться серьезно», — рассказали в публикации.
Сверхзвуковой самолет с крылом изменяемой стреловидности совершил первый полет в 1969 году, а его производство продолжалось до 1993 года. Ракетоносец развивает максимальную скорость до 2300 километров в час, а дальность полета Ту-22М составляет 6800 километров. Самолет может нести бомбы и крылатые ракеты Х-22.
Материалы по теме:
«Ланцет», «Мальва» и бомбы с крыльями.Какое оружие использовала Россия в 2023 году и как оно повлияло на ход СВО?
22 декабря 2023
Белый лебедь.35 лет назад в СССР создали один из лучших бомбардировщиков. Почему Ту-160 до сих пор актуален?
4 августа 2022
Автор приводит слова из отчета Федерации американских ученых, в котором Ту-22М назвали универсальным ударным самолетом. Отмечается, что он предназначен для выполнения задач в Европе и Азии, но также способен «выполнять межконтинентальные миссии против Соединенных Штатов».
В декабре спикер Воздушных сил Вооруженных сил Украины Юрий Игнат рассказал, что ВСУ не сбили ни одной российской ракеты X-22 с начала специальной военной операции. Он отметил, что ракета летит со скоростью четыре тысячи километров в час.",8
"Британия испытала новую боевую разведывательную машину (БРМ) Ajax при температуре минус 36 градусов. Об этом сообщил Королевский бронетанковый корпус Британской армии, передает Army Recognition.
БРМ проходила испытания в Швеции. «Несмотря на суровую погоду, британским солдатам удалось довести свои машины до предела, продемонстрировав возможности Ajax в суровых условиях», — пишет издание.
Отмечается, что целью испытаний была оценка характеристик Ajax в условиях «экстремальных холодов».
Материалы по теме:
Есть пробитие!Как в России научились уничтожать любые танки противника
27 октября 2023
«Ланцет», «Мальва» и бомбы с крыльями.Какое оружие использовала Россия в 2023 году и как оно повлияло на ход СВО?
22 декабря 2023
В основе Ajax лежит БМП ASCOD 2, разработанная австрийской компанией Steyr-Daimler-Puch и испанской Santa Barbara Sistemas. Британский вариант машины получил двухместную башню с пушкой калибра 40 миллиметров, усиленную защиту и новую силовую установку мощностью 805 лошадиных сил.
В декабре стало известно, что Вооруженные силы России с опережением получили все модернизированные боевые машины пехоты БМП-2М с боевыми модулями «Бережок». Модуль получил автоматическую пушку, гранатомет, пулемет и противотанковые ракеты «Корнет». Система управления огнем БМП-2М позволяет в любое время суток уничтожать танки, БМП и укрепления противника.",8
"Средства радиоэлектронной борьбы (РЭБ), которые применяет Российская армия, ослепляют радары систем контрбатарейной борьбы и противовоздушной обороны (ПВО) Вооруженных сил Украины (ВСУ). Возможности российских систем оценило польское издание Polityka.
«Хуже всего то, что русские принимают на вооружение все более эффективные системы радиоэлектронного подавления, которые нарушают управление украинскими беспилотниками, сбивают с толку GPS и управляемое ею оружие, блокируют радиосвязь, ослепляют радары зенитных и контрбатарейных систем, из-за чего вся украинская армия отбрасывается в эпоху мушкетов и шпаг», — пишет издание.
В материале отметили, что современные разработки России тестируют на вооружениях стран НАТО в зоне проведения специальной военной операции. Автор подчеркнул, что это позволит оптимизировать новые системы для противодействия потенциальным противникам.
Материалы по теме:
Невидимый удар.Как новое оружие России выводит из строя вражеские дроны, самолеты и радары?
24 ноября 2022
«Ланцет», «Мальва» и бомбы с крыльями.Какое оружие использовала Россия в 2023 году и как оно повлияло на ход СВО?
22 декабря 2023
Ранее в январе издание Business Insider писало, что применяемые Российской армией средства радиоэлектронной борьбы снижают эффективность гражданских дронов, которые используют ВСУ.
В декабре в Минобороны России сообщили, что станции РЭБ Р-934У «Синица», которые применяют в ходе специальной военной операции, успешно перехватывают украинские дроны.",8
